{
  "schemaVersion": "library-book-source.v1",
  "bookId": "whos-who-in-ai",
  "contentVersion": "whos-who-in-ai-2026-08-24.2",
  "displayTitle": "Who’s Who in AI",
  "eyebrow": "LIVING REFERENCE · SUNNYVAiLE LIBRAiRY",
  "readerJob": "Understand which organisations and decision-makers shape AI, what part each plays, what they control, and how their relationships differ.",
  "lede": "The companies, people and power behind AI—explained through the journey of one ordinary answer, not a wall of logos.",
  "intro": {
    "id": "one-answer",
    "title": "One answer, more companies than you can see",
    "navLabel": "One answer’s journey",
    "bodyHtml": "<p>You open a chatbot and ask it to tidy a difficult email. A reply appears in seconds. It feels like one product did one thing.</p><p>Behind that neat little box may be an organisation that trained the model, another company renting out the enormous computers that run it, a chip designer, factories that manufacture those chips, memory suppliers, equipment makers, investors, distributors and public bodies deciding which rules apply.</p><p>Not every organisation touches your individual question. Some built the system years earlier; some provide the ongoing machinery; some can change the commercial or legal conditions around it. The point is that the name on your screen is the front door, not the whole building.</p><p>A restaurant gives us a useful first picture. The app is the dining room you enter. The model lab develops the recipe and kitchen method. Cloud companies provide rented kitchen space and power. Chip designers plan the chips; semiconductor factories manufacture them; and separate equipment makers supply some of the extraordinary machinery those factories need. Investors help finance the operation. Public authorities set particular rules.</p><p>The analogy has limits. AI companies are not arranged in one tidy restaurant hierarchy, and one company may occupy several roles. But it reveals the hidden dependency: your answer can rely on organisations you never see.</p><p>This book helps you ask one very useful question: <strong>who gives whom what—and what can each party actually change?</strong></p>"
  },
  "chapters": [
    {
      "id": "company-model-product",
      "title": "Company, model and product: sort the names first",
      "navLabel": "Sort the names",
      "bodyHtml": "<p>AI headlines often use a company name, model name and product name as if they were interchangeable. That is how perfectly sensible people end up comparing a chatbot’s user count with a chip company’s manufacturing supply.</p><p><strong>OpenAI</strong> is an organisation. <strong>GPT</strong> names a family of models it develops. A model is the trained pattern-making system behind an answer. <strong>ChatGPT</strong> is a product: the service you open to use models and tools.</p><p>The same sorting works elsewhere. <strong>Anthropic</strong> is a company; <strong>Claude</strong> names its models and products. <strong>Google DeepMind</strong> is an AI research organisation within Alphabet; <strong>Gemini</strong> can refer to model families or products depending on the sentence. <strong>Microsoft Copilot</strong> is a family of Microsoft products, not an independent model laboratory.</p><p>Brands reuse names because ordinary customers do not arrive clutching an organisational chart. So look at the job being described. Did something train the underlying system? That is the model or its developer. Did someone open an app or workplace tool? That is the product. Did a company sign an agreement? That is the organisation.</p><h3>Explain the correction</h3><p>A colleague says, “Claude released a new company.” What would you fix? A useful answer is: Anthropic is the company; Claude is the name used for its models and products. If you answer only “Claude is AI,” you have not yet sorted the jobs.</p>"
    },
    {
      "id": "model-labs",
      "title": "The organisations building the engines",
      "navLabel": "Model labs",
      "bodyHtml": "<p>A <strong>model lab</strong> develops the trained system underneath an AI product. It may also make the product, publish research, release model weights or sell access to other companies. It does not necessarily own the cloud computers or factories it depends on.</p><p>This first edition includes a selective set with an evidence-backed reason to remember each one:</p><p><strong>OpenAI:</strong> remember it for the GPT model family and ChatGPT, plus its consequential Microsoft relationship. <strong>Anthropic:</strong> remember it for Claude and its Amazon/AWS relationship. <strong>Google DeepMind:</strong> remember it for Gemini and scientific work including AlphaFold. <strong>Meta:</strong> remember it because it develops Llama models and can distribute Meta AI through enormous social platforms. <strong>xAI:</strong> remember it for Grok and its connection with X distribution. <strong>Cohere:</strong> remember it for an enterprise and workplace focus. <strong>Mistral AI:</strong> remember it as a France-based model company with a material ASML investment relationship. <strong>DeepSeek:</strong> remember it as a China-based model lab whose official R1 release made model weights and code available under an MIT licence.</p><p>A licence is permission to use something under stated terms. It is not ownership. “Open weights” means people can obtain the trained numerical parameters under the licence; it does not automatically mean the training data, all system components or every possible use is open.</p><p><a href=\"https://api-docs.deepseek.com/news/news250120\">DeepSeek’s R1 release</a> supports that specific availability claim. It does not prove every claim made about cost, independence or market power.</p><p><strong>Geographic boundary:</strong> this is not a complete world directory. Major organisations across China, South Korea, Japan, India, Africa, Latin America and the Middle East still need locally sourced relationship profiles. Their absence is an evidence gap in this edition, not evidence that they are unimportant.</p><h3>Remember the inclusion rule</h3><p>Why include a lab: because it controls a consequential model, research or distribution route—not because it had a loud week online. Fame gets you recognised. A control point gets you onto this map.</p>"
    },
    {
      "id": "money-cloud-and-rights",
      "title": "Does Microsoft own OpenAI? Open the word “partner”",
      "navLabel": "Money, cloud & rights",
      "bodyHtml": "<p>The short answer is: <strong>the cited agreement does not establish that Microsoft owns OpenAI outright.</strong> It describes several different relationships that headlines often compress into the word <em>partner</em>.</p><p><strong>Equity</strong> is a financial slice of a company. OpenAI’s 27 April 2026 statement describes Microsoft as a major shareholder, meaning Microsoft holds equity in OpenAI. A financial stake can influence incentives and may come with particular rights, but it is not the same as owning every part of the company or making every decision.</p><p><strong>Cloud</strong> means rented computing infrastructure elsewhere—the vast collections of computers used to train or operate systems. The same statement calls Microsoft OpenAI’s primary cloud partner and says supported OpenAI products are offered first on Microsoft Azure, subject to an exception. Azure is Microsoft’s cloud platform.</p><p><strong>A licence</strong> is permission to use specified intellectual property. The statement says Microsoft’s licence to specified OpenAI intellectual property through 2032 is non-exclusive. Non-exclusive means Microsoft has permission, but not sole permission.</p><p>The relationship therefore contains at least four different facts: Microsoft holds equity; Microsoft is the primary cloud partner; Azure receives a first-offer route for supported products under the stated condition; and Microsoft has specified licensing rights. None of those sentences can be safely replaced with “Microsoft owns OpenAI.” <a href=\"https://openai.com/index/next-phase-of-microsoft-partnership/\">Read OpenAI’s statement</a>.</p><p>Anthropic and Amazon give us a useful comparison. Anthropic’s 20 April 2026 statement says AWS remains its primary training and cloud provider for mission-critical workloads, while Claude is also available through Google Cloud and Microsoft Azure. The same announcement describes investment and future capacity. Announced capacity is a plan until delivery is established. <a href=\"https://www.anthropic.com/news/anthropic-amazon-compute\">Read Anthropic’s statement</a>.</p><h3>Say it without “partner”</h3><p>Explain what Microsoft has, what Azure does and what neither fact proves. If you have to use “they work together,” open the envelope again. Is the sentence about money, computers, permission, distribution or decision-making?</p>"
    },
    {
      "id": "chip-chain",
      "title": "The logo on the chip is not the whole factory",
      "navLabel": "The chip chain",